title,content
"A responsible, pragmatic and impactful approach",Addressing climate change requires collective efforts...
Credits: Unsplash,"Earlier in June 2019, both Shell and ExxonMobil made important announcements..."
International Edition,Despite more banks pledging to end financing for oil and gas production...
Singapore’s banks are funding a huge problem,How exposed are Singaporean banks to unburnable carbon?...
International Edition,Southeast Asia’s third largest lender United Overseas Bank laid out its interim...
Commentary,Students have called out local universities’ engagement with the fossil fuel industry...
Singapore,The energy and chemicals sector is a key part of the Singapore economy but...
Comparison of Kia Sonet and Maruti Suzuki Brezza variants and prices,Road Fatalities: The Cause of Death...
Banking and Finance Law 2024,Provides essential insights into the current legal issues...
MarketLine Country Profile,"A comprehensive analysis of the economic, political, and business environment..."
